id,raw_text,aspectTerms
367,"Ein hervorragender Service, sehr lecheres Essen und eine sehr nette Bedienung, immer wieder gerne.","[{'term': 'Service', 'polarity': 'positive'}, {'term': 'Essen', 'polarity': 'positive'}, {'term': 'Bedienung', 'polarity': 'positive'}, {'term': 'noaspectterm', 'polarity': 'positive'}]"
394,- Es war schon mal deutlich besser.,"[{'term': 'noaspectterm', 'polarity': 'negative'}]"
429,Das MammaMia ist ein wahrlich schönes Restaurant mit sehr angenehmer und lockerer Atmosphäre.,"[{'term': 'MammaMia', 'polarity': 'positive'}, {'term': 'Atmosphäre', 'polarity': 'positive'}]"
436,Brandy rundeten diesen einmaligen Abend ab.,"[{'term': 'Brandy', 'polarity': 'positive'}]"
456,"Die Tapas waren grandios, die Mitarbeiter/innen waren sehr aufmerksam..wir kommen bald wieder …","[{'term': 'Tapas', 'polarity': 'positive'}, {'term': 'Mitarbeiter/innen', 'polarity': 'positive'}]"
463,"Wurst ist ok, aber nicht das non plus ultra.","[{'term': 'Wurst', 'polarity': 'neutral'}]"
533,Man fühlt sich völlig abgezockt.,"[{'term': 'noaspectterm', 'polarity': 'negative'}]"
567,Das Restaurant im Keller war toll und gut besucht.,"[{'term': 'Restaurant im Keller', 'polarity': 'positive'}]"
571,Dieser sollte mal an einer Schulung teilnehmen in der Ihm der korrekte Umgang mit Gästen und Kollegen näher gebracht wird.,"[{'term': 'noaspectterm', 'polarity': 'negative'}]"
579,Wir konnten uns von der vorzüglichen Qualität der regionalen und selbst gemachten Produkte überzeugen.,"[{'term': 'Produkte', 'polarity': 'positive'}]"
666,Sehr schade.,"[{'term': 'noaspectterm', 'polarity': 'negative'}]"
670,"Die Bedienung war freundlich, flott und gut gelaunt.","[{'term': 'Bedienung', 'polarity': 'positive'}]"
686,Auch das Ambiente ist schön (alte Kupferkessel) und vor allem hat die sehr freundliche Bedienung (Magdalena) zu einem gelungenem Abend beigetragen.,"[{'term': 'Ambiente', 'polarity': 'positive'}, {'term': 'Magdalena', 'polarity': 'positive'}]"
721,"Wer’s zünftig, laut und gesellig mag, der ist hier richtig.","[{'term': 'noaspectterm', 'polarity': 'positive'}]"
783,Das Saisonbier schmeckte ebenfalls.,"[{'term': 'Saisonbier', 'polarity': 'positive'}]"
795,"Es hat gezogen an unserem Platz, es war etwas kalt.","[{'term': 'noaspectterm', 'polarity': 'negative'}]"
840,"2mal Fisch, 1mal herzhafte südamerikanische (!)","[{'term': 'noaspectterm', 'polarity': 'positive'}]"
857,"Wo gibt es die beste Currywurst LOC, natürlich nur hier mitten im LOC.","[{'term': 'Currywurst', 'polarity': 'positive'}]"
913,"Das war eine ausgezeichnete Wahl, denn so hätten wir die Speisen niemals bewusst bestellt.","[{'term': 'Speisen', 'polarity': 'positive'}]"
927,"Ähnliches beobachteten wir dann wiederholt, wurden immernoch nicht bedient und verließen dann das Café.","[{'term': 'noaspectterm', 'polarity': 'negative'}]"
975,Service sehr freundlich und flirty.,"[{'term': 'Service', 'polarity': 'positive'}]"
984,Sehr guter Service von Lena.,"[{'term': 'Lena', 'polarity': 'positive'}]"
992,"Diesmal überzeugte uns das ""Duett vom Hirsch, Roulade und Frikadelle"" eine äußerst gelungene Komposition, die wir mehrmals aßen, weil so noch nie gefunden.","[{'term': 'Duett vom Hirsch', 'polarity': 'positive'}, {'term': 'Roulade', 'polarity': 'positive'}, {'term': 'Frikadelle', 'polarity': 'positive'}]"
1021,"Nun - sicher , es ist Urlaubszeit, Touristen, viele Menschen, es ist warm …Aber - das Aufgeben einer Bestellung dauert sehr lange, dann auch nur, durch lautstarke Aufforderung.","[{'term': 'Bestellung', 'polarity': 'negative'}]"
1023,Die Pizza war perfekt und gut belegt.,"[{'term': 'Pizza', 'polarity': 'positive'}]"
1084,"Teilweise durchgegart, teilweise medium, fast roh und sehr sehr fett.","[{'term': 'noaspectterm', 'polarity': 'negative'}]"
1099,"Die Bedienung war nett, auf den verschmutzen Tisch musste ich hinweisen.","[{'term': 'Bedienung', 'polarity': 'positive'}, {'term': 'Tisch', 'polarity': 'negative'}]"
1114,"Ich bin LOC und ich weiß, dass ich nicht die gleiche Küche wie in LOC finden kann, aber das ist eine echte Beleidilung für uns.","[{'term': 'Küche', 'polarity': 'negative'}]"
1118,Der Nachtisch ging gar nicht.,"[{'term': 'Nachtisch', 'polarity': 'negative'}]"
1122,LOC war auch lecker.,"[{'term': 'LOC', 'polarity': 'positive'}]"
1126,"Aber was den Besuch noch unvergesslicher gemacht hat, war der super nette und kompetente Kellner Bruno.","[{'term': 'Bruno', 'polarity': 'positive'}, {'term': 'noaspectterm', 'polarity': 'positive'}]"
1165,Auch das Essen war so lala.,"[{'term': 'Essen', 'polarity': 'neutral'}]"
1212,"Aber die Bedienung war schon sehr unfreundlich und wollte das Menu nicht ein klein wenig erklären, was bei den Preisen schon ganz nett wäre.","[{'term': 'Bedienung', 'polarity': 'negative'}]"
1264,"Die Möglichkeit, zweimal die Vorspeise zu wählen, wurde verwehrt, selbst nach Angebot, den Betrag zum Selleriegericht aufzustocken.","[{'term': 'noaspectterm', 'polarity': 'negative'}]"
1296,Also für uns definitiv ein no-go und nie mehr wieder.,"[{'term': 'noaspectterm', 'polarity': 'negative'}]"
1320,"Es war so weich gekocht, dass ich es durch die geschlossenen Zahnreihen ziehen konnte.","[{'term': 'noaspectterm', 'polarity': 'negative'}]"
1344,"Die Baguettes billige zum Aufbacken und nicht ansatzweise knusprig, sondern völlig weich und teilweise sogar matschig.","[{'term': 'Baguettes', 'polarity': 'negative'}]"
1360,"Ich fragte, ob es frisch gepressten o-Saft gäbe und wieder eine schnoddrige Antwort, dass sie nur frischen Saft hätten, was sich allerdings als frisch aus dem Tetrapack herausstellte.","[{'term': 'noaspectterm', 'polarity': 'negative'}, {'term': 'Saft', 'polarity': 'negative'}]"
1375,Die Haxe war knusprig und das Fleisch zart.,"[{'term': 'Haxe', 'polarity': 'positive'}, {'term': 'Fleisch', 'polarity': 'positive'}]"
1404,"Was wir dort erlebt haben, war Massenabfertigung sowie ein Kellner, der Gäste, die kein Kölsch oder Änderungen beim Essen wollten, eigentlich permanent beleidigt hat.","[{'term': 'Kellner', 'polarity': 'negative'}, {'term': 'Massenabfertigung', 'polarity': 'negative'}]"
1417,Waren dort um den Abend ausklingen zu lassen - habe beide Biere getrunken und muss sagen habe schon besseres getrunken.,"[{'term': 'Biere', 'polarity': 'negative'}]"
1491,"Schnitzel mit Bratkartoffeln und Salat und Champignonsoße für 19,50 Euro, wenn es gut wär dann wäre der Preis OK aber für ein Schnitzel aus der Fritteuse mit Champignons aus der Dose vielleicht 2 Stück Pilze ein no Go.","[{'term': 'Preis', 'polarity': 'negative'}, {'term': 'Schnitzel mit Bratkartoffeln', 'polarity': 'negative'}, {'term': 'Salat', 'polarity': 'negative'}, {'term': 'Champignonsoße', 'polarity': 'negative'}]"
1565,"Das Steak, das wir bestellten, war einfach himmlisch - perfekt zubereitet und unglaublich zart.","[{'term': 'Steak', 'polarity': 'positive'}]"
1583,Waren zudem vom innerstädtischen fairen Preis überrascht.,"[{'term': 'Preis', 'polarity': 'positive'}]"
1589,Die herzliche Begrüßung und die freundliche Bedienung sowie das gemütliche Ambiente haben uns sehr gefallen.,"[{'term': 'Bedienung', 'polarity': 'positive'}, {'term': 'Ambiente', 'polarity': 'positive'}, {'term': 'Begrüßung', 'polarity': 'positive'}]"
1603,Direkt an der LOC im Zentrum gelegen ist das Restaurant ideal für einen Stopp.,"[{'term': 'Restaurant', 'polarity': 'positive'}]"
1644," Sooft nach LOC und noch nie hier Essen, was für eine Zeitverschwendung!","[{'term': 'noaspectterm', 'polarity': 'negative'}]"
1690,Vorspeise gut.,"[{'term': 'Vorspeise', 'polarity': 'positive'}]"
1698,"Allerdings gab man uns, trotz Reservierung wochenlang im Voraus, einen Tisch hinter dem ständig das dreckige Geschirr von abgeräumten Tischen deponiert wurde.","[{'term': 'Tisch', 'polarity': 'negative'}]"
1699,"War zwar viel los, dennoch hat das Personal nicht an Höflichkeit und Spaß verloren.","[{'term': 'Personal', 'polarity': 'positive'}]"
1704,"Wir haben über 90 Minuten gewartet, bis wir unser Essen bekommen haben.","[{'term': 'noaspectterm', 'polarity': 'negative'}]"
1728,Ich kann nur sagen: FINGER WEG!!!,"[{'term': 'noaspectterm', 'polarity': 'negative'}]"
1741,Kaffee und Teewasser waren kalt.,"[{'term': 'Kaffee', 'polarity': 'negative'}, {'term': 'Teewasser', 'polarity': 'negative'}]"
1767,Wagner muss man mögen............die Kellner sind schon seit mehr als 20 Jahren die gleichen und man muss Sie mögen.,"[{'term': 'Kellner', 'polarity': 'positive'}, {'term': 'Wagner', 'polarity': 'positive'}]"
1768,Frühstück war super lecker.,"[{'term': 'Frühstück', 'polarity': 'positive'}]"
1790,Also wer großen Hunger hat wird wahrscheinlich nicht zufrieden gestellt.,"[{'term': 'noaspectterm', 'polarity': 'negative'}]"
1792,"Der Service wirkte gestresst (kein Wunder), war aber freundlich jedoch auch recht unpersönlich, alles musste zackig bestellt werden, Fliessbandfeeling.","[{'term': 'Service', 'polarity': 'negative'}]"
1796,"Wir waren zufrieden, für den starken Geschäftsgang, kann das Restaurant ja nichts.","[{'term': 'noaspectterm', 'polarity': 'positive'}]"
1849,Sehr aufmerksame und nette Bedienung.,"[{'term': 'Bedienung', 'polarity': 'positive'}]"
1865,Trotz Reservierung unfreundlich abgewiesen.,"[{'term': 'noaspectterm', 'polarity': 'negative'}]"
1887,Das Schnitzel (zwei längliche Schnitzelstücke) war von Form und Beschaffenheit der Panade ein Convenient-Produkt.,"[{'term': 'Schnitzel', 'polarity': 'negative'}, {'term': 'Schnitzelstücke', 'polarity': 'negative'}]"
1905,Für diesen Preis trotzdem eine Zumutung.,"[{'term': 'Preis', 'polarity': 'negative'}, {'term': 'noaspectterm', 'polarity': 'negative'}]"
1914,"Obwohl es ein sehr großes Lokal ist, konnten wir uns sehr gut unterhalten und fanden die Atmosphäre sehr angenehm.","[{'term': 'Atmosphäre', 'polarity': 'positive'}]"
1936,"Es sei denn, man steht darauf, vom Eigentümer beleidigt zu werden.","[{'term': 'Eigentümer', 'polarity': 'negative'}]"
1939,Wir waren hier zum Mittagessen und wurden eher enttäuscht.,"[{'term': 'noaspectterm', 'polarity': 'negative'}]"
1961,"Immer wieder gerne, sehr nettes und kompetentes Personal.","[{'term': 'Personal', 'polarity': 'positive'}, {'term': 'noaspectterm', 'polarity': 'positive'}]"
1971,Qualität der Speisen und Optik in Ordnung.,"[{'term': 'Speisen', 'polarity': 'neutral'}]"
1975,Der Blick von der Dachterasse ist der Wahnsinn.,"[{'term': 'Blick von der Dachterasse', 'polarity': 'positive'}]"
1996,Hier stimmt alles!,"[{'term': 'noaspectterm', 'polarity': 'positive'}]"
2001,Tolle Auswahl an Speisen und Getränken.,"[{'term': 'Speisen', 'polarity': 'positive'}, {'term': 'Getränken', 'polarity': 'positive'}]"
2031,Mal dort und werde wiederkommen wenn ich wieder in LOC bin.,"[{'term': 'noaspectterm', 'polarity': 'positive'}]"
2085,"Atmosphäre des Lokals ist gut, Personal reagierte auf den Wunsch, beim Salat eine Zutat wegzulassen allerdings unflexibel und der Inhaber ist mehr als unfreundlich.","[{'term': 'Atmosphäre', 'polarity': 'positive'}, {'term': 'Inhaber', 'polarity': 'negative'}, {'term': 'Personal', 'polarity': 'negative'}]"
2100,Gastfreundschaft geht anders.,"[{'term': 'Gastfreundschaft', 'polarity': 'negative'}]"
2126,"Das Essen war außerdem nicht warm genug, die Gambas trocken und der Lauch war alt und hart und ungenießbar.","[{'term': 'Essen', 'polarity': 'negative'}, {'term': 'Gambas', 'polarity': 'negative'}, {'term': 'Lauch', 'polarity': 'negative'}]"
2136,"Wir haben Entrecotes/Filets, dazu superfeine Beilagen (zB Stampf, Schlotze oder Spinat) gegessen, im Nachgang noch die Spaghetti mit Tomatensauce (Eis-Dessert).","[{'term': 'Beilagen', 'polarity': 'positive'}, {'term': 'Stampf', 'polarity': 'positive'}, {'term': 'Schlotze', 'polarity': 'positive'}, {'term': 'Spinat', 'polarity': 'positive'}]"
2147,Für uns hat es sich erledigt!,"[{'term': 'noaspectterm', 'polarity': 'negative'}]"
0,Gemütliche Atmung und rustikale Deko an Wänden.,"[{'term': 'Atmung', 'polarity': 'positive'}, {'term': 'Deko an Wänden', 'polarity': 'positive'}]"
119,"Super Abend, ich komme regelmäßig zum Steak essen in die RESTAURANT_NAME.","[{'term': 'RESTAURANT_NAME', 'polarity': 'positive'}]"
185,Es gibt auch eine große Auswahl an Bieren.,"[{'term': 'Bieren', 'polarity': 'positive'}]"
205,Uns hat es leider nicht überzeugt.,"[{'term': 'noaspectterm', 'polarity': 'negative'}]"
242,Allein der Rotwein war nichts Besonderes.,"[{'term': 'Rotwein', 'polarity': 'neutral'}]"
314,Unsere Erwartungen wurden sogar noch übertroffen.,"[{'term': 'noaspectterm', 'polarity': 'positive'}]"
329,"Der sogenannte Chef de Service wurde sehr laut und wiederholte sich ständig, dass wir ja schliesslich zu spät gekommen seien.","[{'term': 'Chef de Service', 'polarity': 'negative'}]"
341,Ich habe hier einen wirklich leckeren Burger gegessen und die Atmosphäre war einfach toll!,"[{'term': 'Burger', 'polarity': 'positive'}, {'term': 'Atmosphäre', 'polarity': 'positive'}]"
345,Die Lage direkt an der LOC ist nicht zu übertreffen.,"[{'term': 'Lage', 'polarity': 'positive'}]"
393,"Dass man dort nicht ein einziges Gewürz in der Küche stehen hat, muss ich wohl kaum betonen.","[{'term': 'noaspectterm', 'polarity': 'negative'}]"
419,"Super für sorglose, entspannte Familienfeiern, große Auswahl, viele Getränke inklusive, super Service","[{'term': 'Auswahl', 'polarity': 'positive'}, {'term': 'Getränke', 'polarity': 'positive'}, {'term': 'Service', 'polarity': 'positive'}, {'term': 'noaspectterm', 'polarity': 'positive'}]"
459,Der Service war trotz des Trubels aufmerksam und sehr freundlich.,"[{'term': 'Service', 'polarity': 'positive'}]"
465,Leider war der Hauptgang Rinderfilet so zäh und durchwachsen dass dies den guten Gesamteindruck nachhaltig beschädigt hat.,"[{'term': 'Rinderfilet', 'polarity': 'negative'}]"
473,"Sie war super freundlich, zuvorkommend und kompetent :)","[{'term': 'noaspectterm', 'polarity': 'positive'}]"
480,Leider schlecht.,"[{'term': 'noaspectterm', 'polarity': 'negative'}]"
484,"Besonders hervorzuheben, war der Kellner Jacques.","[{'term': 'Jacques', 'polarity': 'positive'}]"
488,Die Schnitzel war sehr lecker und auch die Soßen waren nicht pampig.,"[{'term': 'Schnitzel', 'polarity': 'positive'}, {'term': 'Soßen', 'polarity': 'positive'}]"
520,"Das findet man sonst nicht, und macht die Faszination LOC aus.","[{'term': 'LOC', 'polarity': 'positive'}]"
594,"Der laue Sommerabend unter den grossen Sonnensegeln war schoen, allerdings wirkt der Aussenbereich etwas sehr „selbstgemacht“, das kann sicher boch etwas schöner werden.","[{'term': 'Sommerabend unter den grossen Sonnensegeln', 'polarity': 'positive'}, {'term': 'Aussenbereich', 'polarity': 'negative'}]"
611,Schade.,"[{'term': 'noaspectterm', 'polarity': 'negative'}]"
649,"Kein Danke, kein Auf Wiedersehen .","[{'term': 'noaspectterm', 'polarity': 'negative'}]"
650,"Authentisch, so wie ich es mag.. hatte klassisch ein schnitzel mit jägersauce… must try.","[{'term': 'schnitzel mit jägersauce', 'polarity': 'positive'}]"
657,Fazit: Geht gar nicht !,"[{'term': 'noaspectterm', 'polarity': 'negative'}]"
663,"Um uns zu unterhalten, mussten wir uns fast schon anschreien.","[{'term': 'noaspectterm', 'polarity': 'negative'}]"
680,"Es ist sehr schade, dass die Gäste in diesem Restaurant so behandelt werden.","[{'term': 'noaspectterm', 'polarity': 'negative'}]"
685,"Dafür ohne Reservierung im überfüllten RESTAURANT_NAME trotzdem eine angenehme Platz-Zuweisung vor Ort,naja,bei DEN Preisen…","[{'term': 'Preisen', 'polarity': 'negative'}, {'term': 'Platz-Zuweisung', 'polarity': 'positive'}, {'term': 'RESTAURANT_NAME', 'polarity': 'negative'}]"
692,Der danach bestellte Glasnudelsalat war langweilig gewürzt.,"[{'term': 'Glasnudelsalat', 'polarity': 'negative'}]"
723,"Nach zehn Minuten, als wir noch den zähen Braten versuchten runterzubekommen wurde die Außenbeleuchtung der LOC entfernt und die Schirme zusammengeklappt, da es etwas windig war und möglicher weiße ein Gewitter aufzog.","[{'term': 'Braten', 'polarity': 'negative'}]"
750,"Ein tolles Gewölbe, gutes Konzept, angenehme jazzige Hintergrundmusik, gute Speisekarte.","[{'term': 'Gewölbe', 'polarity': 'positive'}, {'term': 'Hintergrundmusik', 'polarity': 'positive'}, {'term': 'Speisekarte', 'polarity': 'positive'}]"
766,Sehr leckeres Essen und super Happy Hour für Cocktails!,"[{'term': 'Essen', 'polarity': 'positive'}, {'term': 'Cocktails', 'polarity': 'positive'}]"
865,"Die Speisen sind einfache, bayerische Klassiker in guter Qualität.","[{'term': 'Speisen', 'polarity': 'positive'}]"
893,Mit leckerem Wein tollem Essen und einem super Service.,"[{'term': 'Wein', 'polarity': 'positive'}, {'term': 'Essen', 'polarity': 'positive'}, {'term': 'Service', 'polarity': 'positive'}]"
897,Essen war absolut in Ordnung.,"[{'term': 'Essen', 'polarity': 'neutral'}]"
915,Kommen bestimmt wieder.,"[{'term': 'noaspectterm', 'polarity': 'positive'}]"
951,Die Mitarbeiter waren sehr freundlich und schnell obwohl es sehr voll war.,"[{'term': 'Mitarbeiter', 'polarity': 'positive'}]"
1070,"Der schlechteste und zugleich teuerste Burger aller Zeiten für 14,90 € ohne jegliche Beilage.","[{'term': 'Burger', 'polarity': 'negative'}, {'term': 'Burger', 'polarity': 'negative'}]"
1094,"Nie wieder ""Früh am LOC""...Soviel Arroganz, Ignoranz und Unfreundlichkeit kann EIN (1) Mensch doch gar nicht alleine haben!!","[{'term': 'noaspectterm', 'polarity': 'negative'}, {'term': 'noaspectterm', 'polarity': 'negative'}]"
1139,Mit der Reservierung des Tisches ( 4 Personen -( satte 120 €) - mit diesen 4 Burgern und 4 kleinen Getränken haben wir schließlich 245 € gezahlt !,"[{'term': 'noaspectterm', 'polarity': 'negative'}]"
1179,"Wir erhielten kleine Teller mit recht überschaubaren Portionen (keine Oliven, die ich bei jeder Art von Griechen erwarte ) Geschmacklich war alles in Ordnung.","[{'term': 'noaspectterm', 'polarity': 'neutral'}, {'term': 'Portionen', 'polarity': 'negative'}]"
1181,Bier kann man gut trinken und der Service war sehr nett.,"[{'term': 'Bier', 'polarity': 'positive'}, {'term': 'Service', 'polarity': 'positive'}]"
1195,"Allerdings dauerte es ewig bis das Essen kam, obwohl das Lokal nur zu 1/3 gefüllt war.","[{'term': 'noaspectterm', 'polarity': 'negative'}]"
1217,"Das geht gar nicht, wenn man zu zweit essen geht!!","[{'term': 'noaspectterm', 'polarity': 'negative'}]"
1288,Mit eine Männergruppe wären alle verhungert!,"[{'term': 'noaspectterm', 'polarity': 'negative'}]"
1306,Unglaublich enttäuschend.,"[{'term': 'noaspectterm', 'polarity': 'negative'}]"
1319,"Richtig cool sind die vielen Stammtische, wo jeder ein eigenes Wappen hat, sowie die versperrten Bierkrüge.","[{'term': 'Stammtische', 'polarity': 'positive'}, {'term': 'Bierkrüge', 'polarity': 'positive'}]"
1335,Schönes Ambiente.,"[{'term': 'Ambiente', 'polarity': 'positive'}]"
1341,Insgesamt empfand ich das gesamte Servicepersonal als herablassend.,"[{'term': 'Servicepersonal', 'polarity': 'negative'}]"
1349,"Als Kommentar kam nur der freche Spruch: das ist ebenso, da die Toilette im Untergeschoss sei.","[{'term': 'noaspectterm', 'polarity': 'negative'}]"
1356,Die Kellner sind alle sehr nett und zuvorkommend,"[{'term': 'Kellner', 'polarity': 'positive'}]"
1357,Ein tolles italienisches Restaurant.,"[{'term': 'Restaurant', 'polarity': 'positive'}]"
1453,Schlechtester Service ever!,"[{'term': 'Service', 'polarity': 'negative'}]"
1478,Selbst am Nachbartisch hat eine Frau nur ein paar Happen von Ihrer Haxe und dem Knödel gegessen und den Rest zurückgegeben.,"[{'term': 'noaspectterm', 'polarity': 'negative'}]"
1530,"Auf meine Beschwerde hin wurde mir gesagt, dass das bayrische Bier eben viel Schaum habe.","[{'term': 'noaspectterm', 'polarity': 'negative'}]"
1536,Preis / Leistung stimmt.,"[{'term': 'Preis / Leistung', 'polarity': 'positive'}]"
1568,Die Möglichkeit online zu bestellen ist innovativ.,"[{'term': 'noaspectterm', 'polarity': 'positive'}]"
1581,wahren alle super zuvorkommend und lieb.,"[{'term': 'noaspectterm', 'polarity': 'positive'}]"
1593,"Die von uns ausgewählten Salate waren frisch, lecker und reichhaltig.","[{'term': 'Salate', 'polarity': 'positive'}]"
1601,"Wir haben dann Lasagne bestellt, die leider ziemlich kalt serviert wurde und auch sonst nur durchschnittlich geschmeckt hat.","[{'term': 'Lasagne', 'polarity': 'negative'}]"
1622,Es gab keine reine Rebe und zudem recht teuer.,"[{'term': 'noaspectterm', 'polarity': 'negative'}, {'term': 'noaspectterm', 'polarity': 'negative'}]"
1629,"Das LOC schmeckte sehr gut, die hausgemachten Spätzle exzellent.","[{'term': 'LOC', 'polarity': 'positive'}, {'term': 'Spätzle', 'polarity': 'positive'}]"
1771,"Anschließend hatte jeder ein Maß bestellt, wo die fast die Hälfte des Bieres aus Schaum bestand, allein das grenzte an Betrug.","[{'term': 'Bieres', 'polarity': 'negative'}]"
1779,Hier werden Sie mit leckerem Sardellencreme serviert.,"[{'term': 'Sardellencreme', 'polarity': 'positive'}]"
1783,"Fränkische Bratwürste, die waren gut, aber das Sauerkraut dazu hat nach gar nichts geschmeckt.","[{'term': 'Fränkische Bratwürste', 'polarity': 'positive'}, {'term': 'Sauerkraut', 'polarity': 'negative'}]"
1801,"Für uns steht klar ,es war das erste und letzte mal .","[{'term': 'noaspectterm', 'polarity': 'negative'}]"
1819,Das Essen war sehr gut!,"[{'term': 'Essen', 'polarity': 'positive'}]"
1836,Schnelle Küche mit geringem Anspruch.,"[{'term': 'Küche', 'polarity': 'negative'}]"
1841,"Ein solides italienisches Restaurant in der LOC, mit selbstgemachte Pasta, guter Auswahl und immer wieder ein Besuch wert.","[{'term': 'Restaurant', 'polarity': 'positive'}, {'term': 'Auswahl', 'polarity': 'positive'}, {'term': 'noaspectterm', 'polarity': 'positive'}]"
1843,Ganz klare Empfehlungen unsererseits.,"[{'term': 'noaspectterm', 'polarity': 'positive'}]"
1844,Toll finde ich auch die Speisekarte.,"[{'term': 'Speisekarte', 'polarity': 'positive'}]"
1866,"30% - ausreichend Personal, System der Annahme von Bestellungen nicht erkennbar.","[{'term': 'System der Annahme von Bestellungen', 'polarity': 'negative'}]"
1879,Es war ein toller Abend.,"[{'term': 'noaspectterm', 'polarity': 'positive'}]"
1918,23 abends dann doch etwas frisch auf der Terrasse.,"[{'term': 'Terrasse', 'polarity': 'negative'}]"
1920,Auch die Schnitzel kamen innerhalb einer 5-Minuten Frist und waren Massenware.,"[{'term': 'Schnitzel', 'polarity': 'negative'}]"
1933,Hier wird man schlicht verarscht.,"[{'term': 'noaspectterm', 'polarity': 'negative'}]"
1940,Hätte gerne nach dem tollen Essen einen Fernet Branca bestellt.,"[{'term': 'Essen', 'polarity': 'positive'}]"
1972,Nix zu bemängeln.,"[{'term': 'noaspectterm', 'polarity': 'positive'}]"
1976,"Die Vorspeisen sind normalerweise sehr zu empfehlen,aber hier stimmt das Preis-Leistungsverhältnis überhaupt nicht mehr.","[{'term': 'Vorspeisen', 'polarity': 'positive'}, {'term': 'Vorspeisen', 'polarity': 'negative'}]"
1992,Ich ziehe meinen Hut vor den Kollegen und Kolleginnen aus der Küche und dem Service.,"[{'term': 'Service', 'polarity': 'positive'}, {'term': 'Kollegen und Kolleginnen aus der Küche', 'polarity': 'positive'}]"
2011,"Eine der Servicekräfte deutete auf die Uhr und teilte mir in einem barschen Tonfall mit, dass man um 22:00 Uhr schließe.","[{'term': 'Servicekräfte', 'polarity': 'negative'}]"
2088,Getränke und Speisen standen ruckzuck auf dem Tisch.,"[{'term': 'noaspectterm', 'polarity': 'positive'}]"
2095,unumgängliches Restaurant!,"[{'term': 'Restaurant', 'polarity': 'positive'}]"
2110,"Der junge Service ist äußerst freundlich, erklärt sehr angenehm und macht seinen Job gerne.","[{'term': 'Service', 'polarity': 'positive'}]"
2128,Sehr nettes Ambiente drin wie draußen.,"[{'term': 'drin', 'polarity': 'positive'}, {'term': 'draußen', 'polarity': 'positive'}]"
