id,raw_text,aspectTerms
1320,DieTische sind klein und so eng gestellt das man das Gefühl hat beim Nachbarn auf dem Schoß zu sitzen.,"[{'term': 'DieTische', 'polarity': 'negative'}]"
1337,Hätte gerne nach dem tollen Essen einen Fernet Branca bestellt.,"[{'term': 'Essen', 'polarity': 'positive'}]"
1344,Insbesondere die Livemusik macht das Ganze zu einer tollen Erfahrung.,"[{'term': 'Livemusik', 'polarity': 'positive'}]"
1377,Leider hat die Fischqualität in letzter Zeit sehr stark nachgelassen.,"[{'term': 'Fischqualität', 'polarity': 'negative'}]"
1384,Sehr gut fanden wir die Auswahl an offenen Weinen.,"[{'term': 'Auswahl an offenen Weinen', 'polarity': 'positive'}]"
1387,Aber trotzdem ist der Besuch lohnend und zu empfehlen.,"[{'term': 'Besuch', 'polarity': 'positive'}]"
1412,Absolut freundlicher Kellner ( Chef ?,"[{'term': 'Kellner', 'polarity': 'positive'}]"
1451,Sehr netter Service und leckeres Essen.,"[{'term': 'Service', 'polarity': 'positive'}, {'term': 'Essen', 'polarity': 'positive'}]"
