id,raw_text,aspectTerms
38,The sushi seemed pretty fresh and was adequately proportioned.,"[{'term': 'sushi', 'polarity': 'positive'}, {'term': 'sushi', 'polarity': 'positive'}]"
39,The rice to fish ration was also good--they didn't try to overpack the rice.,"[{'term': 'rice to fish ration', 'polarity': 'positive'}]"
74,"Everytime I decide to try another place on the UES, I get angry that I didn't just go to Zucchero Pomodori.","[{'term': 'Zucchero Pomodori', 'polarity': 'positive'}]"
98,Located at the end of a magnificent block.,"[{'term': 'block', 'polarity': 'positive'}]"
117,"Pizza - the only pizza in NYC that should not have additional toppings - the crust tastes like the best, freshly baked bread!","[{'term': 'crust', 'polarity': 'positive'}, {'term': 'pizza', 'polarity': 'positive'}]"
120,I'd highly recommend it for a special occasion -- it provides and intimate setting and nice service.,"[{'term': 'setting', 'polarity': 'positive'}, {'term': 'service', 'polarity': 'positive'}]"
132,The staff is incredibly helpful and attentive.,"[{'term': 'staff', 'polarity': 'positive'}]"
140,The food was good too.,"[{'term': 'food', 'polarity': 'positive'}]"
158,Try the lobster teriyaki and the rose special roll.,"[{'term': 'lobster teriyaki', 'polarity': 'positive'}, {'term': 'rose special roll', 'polarity': 'positive'}]"
172,"If we were to move from the upper east side, we would genuinely miss this restaurant.","[{'term': 'restaurant', 'polarity': 'positive'}]"
199,Hats off to the chef.,"[{'term': 'chef', 'polarity': 'positive'}]"
216,"And it all comes at a very reasonable price (congee, noodles, and rice dishes are no more than $3-6 each).","[{'term': 'congee', 'polarity': 'positive'}, {'term': 'noodles', 'polarity': 'positive'}, {'term': 'rice dishes', 'polarity': 'positive'}]"
266,"Cute place, nice wait staff but would never go there again.","[{'term': 'wait staff', 'polarity': 'positive'}, {'term': 'place', 'polarity': 'positive'}, {'term': 'place', 'polarity': 'negative'}]"
292,The food is amazing... especially if you get the Chef's tasting menu and your favourite bottle (or two!) of wine from an extensive selection of wines.,"[{'term': 'food', 'polarity': 'positive'}, {'term': 'selection of wines', 'polarity': 'positive'}, {'term': ""Chef's tasting menu"", 'polarity': 'positive'}]"
310,"However, I think Jeckll and Hydes t is one of those places that is fun to do once.","[{'term': 'Jeckll and Hydes', 'polarity': 'positive'}]"
335,"Despite a slightly limited menu, everything prepared is done to perfection, ultra fresh and a work of food art.","[{'term': 'menu', 'polarity': 'negative'}]"
344,"The food is delicious - from the specials to the regular menu-fare, the dishes are never a disappointment.","[{'term': 'food', 'polarity': 'positive'}, {'term': 'dishes', 'polarity': 'positive'}, {'term': 'specials', 'polarity': 'positive'}, {'term': 'regular menu-fare', 'polarity': 'positive'}]"
348,"If you go, try the marinara/arrabiatta sauce, the mozzarella en Carozza is mmmmmmmm..... everything is just delicious.","[{'term': 'marinara/arrabiatta sauce', 'polarity': 'positive'}, {'term': 'mozzarella en Carozza', 'polarity': 'positive'}]"
360,But the staff was so horrible to us.,"[{'term': 'staff', 'polarity': 'negative'}]"
362,We were planning to get dessert but the waitress basically through the bill at us before we had a chance to order.,"[{'term': 'waitress', 'polarity': 'negative'}]"
368,This place is always packed.,"[{'term': 'place', 'polarity': 'neutral'}]"
383,I have been to Roth's twice and both times were very disappointing.,"[{'term': ""Roth's"", 'polarity': 'negative'}]"
387,With the theater 2 blocks away we had a delicious meal in a beautiful room.,"[{'term': 'meal', 'polarity': 'positive'}, {'term': 'room', 'polarity': 'positive'}]"
396,Chennai Garden is my favorite Indian restaurant in the city.,"[{'term': 'Chennai Garden', 'polarity': 'positive'}]"
415,"Even though its good seafood, the prices are too high.","[{'term': 'seafood', 'polarity': 'positive'}, {'term': 'seafood', 'polarity': 'negative'}]"
421,We ate at this Thai place following the reviews but very unhappy with the foods.,"[{'term': 'foods', 'polarity': 'negative'}]"
460,"The staff has been nice, but they seemed really stressed and the unisex bathroom needs to be cleaned more often.","[{'term': 'staff', 'polarity': 'positive'}, {'term': 'staff', 'polarity': 'negative'}, {'term': 'unisex bathroom', 'polarity': 'negative'}]"
514,"Service here was great, food was fantastic.","[{'term': 'Service', 'polarity': 'positive'}, {'term': 'food', 'polarity': 'positive'}]"
516,You cannot go wrong with this place.,"[{'term': 'place', 'polarity': 'positive'}]"
531,"The first time the sushi was outstanding, the second time it was a little bland.","[{'term': 'sushi', 'polarity': 'positive'}, {'term': 'sushi', 'polarity': 'negative'}]"
554,"Their calzones are horrific, bad, vomit-inducing, YUCK.","[{'term': 'calzones', 'polarity': 'negative'}]"
561,"The atmosphere is unheralded, the service impecible, and the food magnificant.","[{'term': 'atmosphere', 'polarity': 'positive'}, {'term': 'service', 'polarity': 'positive'}, {'term': 'food', 'polarity': 'positive'}]"
565,"The food is good, especially their more basic dishes, and the drinks are delicious.","[{'term': 'food', 'polarity': 'positive'}, {'term': 'basic dishes', 'polarity': 'positive'}, {'term': 'drinks', 'polarity': 'positive'}]"
567,Great sushi experience.,"[{'term': 'sushi', 'polarity': 'positive'}]"
570,"Good spreads, great beverage selections and bagels really tasty.","[{'term': 'spreads', 'polarity': 'positive'}, {'term': 'beverage selections', 'polarity': 'positive'}, {'term': 'bagels', 'polarity': 'positive'}]"
588,"The fish was adequate, but inexpertly sliced.","[{'term': 'fish', 'polarity': 'negative'}]"
609,"The wait staff is pleasant, fun, and for the most part gorgeous (in the wonderful aesthetic beautification way, not in that she's-way-cuter-than-me-that-b@#$* way).","[{'term': 'wait staff', 'polarity': 'positive'}]"
627,The food is excellent! ,"[{'term': 'food', 'polarity': 'positive'}]"
630,"The rest of the dim sum, though pricey by Chinatown standards, is worth it.","[{'term': 'dim sum', 'polarity': 'negative'}, {'term': 'dim sum', 'polarity': 'positive'}]"
646,Service is fast and friendly.,"[{'term': 'Service', 'polarity': 'positive'}]"
647,"The food is decent at best, and the ambience, well, it's a matter of opinion, some may consider it to be a sweet thing, I thought it was just annoying.","[{'term': 'food', 'polarity': 'negative'}, {'term': 'ambience', 'polarity': 'negative'}]"
655,I really loved the different and inovated touch that's the cheff gives to the food.,"[{'term': 'cheff', 'polarity': 'positive'}]"
670,"The anti-pasta was excellent, especially the calamari, as were the filling pasta mains.","[{'term': 'anti-pasta', 'polarity': 'positive'}, {'term': 'calamari', 'polarity': 'positive'}, {'term': 'pasta mains', 'polarity': 'positive'}, {'term': 'pasta mains', 'polarity': 'positive'}]"
679,I have been doing all of the above at the Heartland Brewery for over 5 years now and I HAVE NEVER BEEN DISAPPOINTED!,"[{'term': 'Heartland Brewery', 'polarity': 'positive'}]"
683,The shrimp scampi was excellent and the antipasti were plentiful.,"[{'term': 'shrimp scampi', 'polarity': 'positive'}, {'term': 'antipasti', 'polarity': 'positive'}]"
708,"Great spot, whether looking for a couple of drinks or quiet dinner.","[{'term': 'spot', 'polarity': 'positive'}, {'term': 'spot', 'polarity': 'positive'}]"
725,"Service, however, was excellent...and I liked the setting/atmosphere a lot. ","[{'term': 'Service', 'polarity': 'positive'}, {'term': 'setting/atmosphere', 'polarity': 'positive'}]"
730,Don't waste money on decor.,"[{'term': 'decor', 'polarity': 'neutral'}]"
743,the drinks are amazing and half off till 8pm.,"[{'term': 'drinks', 'polarity': 'positive'}, {'term': 'drinks', 'polarity': 'positive'}]"
745,My fav was the sassy lassi...,"[{'term': 'sassy lassi', 'polarity': 'positive'}]"
769,The portions are small but being that the food was so good makes up for that.,"[{'term': 'portions', 'polarity': 'negative'}, {'term': 'food', 'polarity': 'positive'}]"
793,"This place, which is only a few months old, is perhaps Queens' biggest secret!","[{'term': 'place', 'polarity': 'positive'}]"
800,Baluchi's has solid food and a nice decor at reasonable prices.,"[{'term': 'food', 'polarity': 'positive'}, {'term': 'decor', 'polarity': 'positive'}, {'term': ""Baluchi's"", 'polarity': 'positive'}]"
807,"Most of the servers are very attentive, friendly and quite attractive.","[{'term': 'servers', 'polarity': 'positive'}]"
822,I recieved prompt service with a smile.,"[{'term': 'service', 'polarity': 'positive'}]"
845,I was visiting New York City with a friend and we discovered this really warm and inviting restaurant.,"[{'term': 'restaurant', 'polarity': 'positive'}]"
848,"Excellent food, although the interior could use some help.","[{'term': 'food', 'polarity': 'positive'}, {'term': 'interior', 'polarity': 'negative'}]"
858,This place has ruined me for neighborhood sushi.,"[{'term': 'sushi', 'polarity': 'positive'}]"
866,Good food: my favorite is the seafood spaghetti.,"[{'term': 'food', 'polarity': 'positive'}, {'term': 'seafood spaghetti', 'polarity': 'positive'}]"
867,Excellent food for great prices,"[{'term': 'food', 'polarity': 'positive'}, {'term': 'food', 'polarity': 'positive'}]"
869,"The space is limited so be prepared to wait up to 45 minutes - 1 hour, but be richly rewarded when you savor the delicious indo-chinese food.","[{'term': 'space', 'polarity': 'negative'}, {'term': 'indo-chinese food', 'polarity': 'positive'}]"
884,"Very immature bartender, didnt know how to make specific drinks, service was so slowwwww, the food was not fresh or warm, waitresses were busy flirting with men at the bar and werent very attentive to all the customers.","[{'term': 'bartender', 'polarity': 'negative'}, {'term': 'service', 'polarity': 'negative'}, {'term': 'food', 'polarity': 'negative'}, {'term': 'waitresses', 'polarity': 'negative'}]"
904,Gross food – Wow-,"[{'term': 'food', 'polarity': 'negative'}]"
908,"Don't get me started on the margaritas, either.","[{'term': 'margaritas', 'polarity': 'negative'}]"
916,I highly recommend this beautiful place.,"[{'term': 'place', 'polarity': 'positive'}, {'term': 'place', 'polarity': 'positive'}]"
917,We were offered water for the table but were not told the Voss bottles of water were $8 a piece.,"[{'term': 'Voss bottles of water', 'polarity': 'negative'}]"
921,A beautifully designed dreamy Egyptian restaurant that gets sceney at night.,"[{'term': 'Egyptian restaurant', 'polarity': 'positive'}]"
951,The high prices you're going to pay is for the view not for the food.,"[{'term': 'view', 'polarity': 'neutral'}, {'term': 'food', 'polarity': 'negative'}]"
954,"We thought the dessert would be better, Wrong!","[{'term': 'dessert', 'polarity': 'negative'}]"
967,The food was ok and fair nothing to go crazy.,"[{'term': 'food', 'polarity': 'neutral'}]"
992,"For a restaurant with such a good reputation and that is usually so packed, there was no reason for such a lack of intelligent customer service.","[{'term': 'restaurant', 'polarity': 'positive'}, {'term': 'customer service', 'polarity': 'negative'}]"
1028,"For me dishes a little oily, but overall dining experience good.","[{'term': 'dishes', 'polarity': 'negative'}]"
1047,"Yes, the place is classy and beautiful, but they most certainly target the uber whealthy Not the common joe that wants to go all out every once in a while.","[{'term': 'place', 'polarity': 'positive'}, {'term': 'place', 'polarity': 'negative'}]"
1056,"You would think they would make up for it with service, sadly, no.","[{'term': 'service', 'polarity': 'negative'}]"
1099,I book a gorgeous white organza tent which included a four course prix fix menu which we enjoyed a lot.,"[{'term': 'four course prix fix menu', 'polarity': 'positive'}, {'term': 'white organza tent', 'polarity': 'positive'}]"
1103,Too bad I had paid an extra $2 for the stone bowl.,"[{'term': 'stone bowl', 'polarity': 'negative'}]"
1106,The sauce tasted more like Chinese fast food than decent Korean.,"[{'term': 'sauce', 'polarity': 'negative'}]"
1107,"The side dishes were passable, and I did get a refill upon request.","[{'term': 'side dishes', 'polarity': 'neutral'}, {'term': 'side dishes', 'polarity': 'neutral'}]"
1112,i love margherita pizza – i looove east village pizza,"[{'term': 'east village pizza', 'polarity': 'positive'}, {'term': 'margherita pizza', 'polarity': 'positive'}]"
1138,The food tasted very good.,"[{'term': 'food', 'polarity': 'positive'}]"
1153,"Our waitress wasn't mean, but not especially warm or attentive either.","[{'term': 'waitress', 'polarity': 'neutral'}]"
1179,"How this place survives the competitive west village market in this economy, or any other for that matter, is beyond me.","[{'term': 'place', 'polarity': 'negative'}]"
1189,The frizzy retro girl (with winged/ Dame Edna glasses) will yell at you if you try to order a drink. ,"[{'term': 'girl', 'polarity': 'negative'}]"
1194,"The food and service were fine, however the maitre-D was incredibly unwelcoming and arrogant.","[{'term': 'food', 'polarity': 'positive'}, {'term': 'service', 'polarity': 'positive'}, {'term': 'maitre-D', 'polarity': 'negative'}]"
23,"The spicy tuna roll was unusually good and the rock shrimp tempura was awesome, great appetizer to share!","[{'term': 'spicy tuna roll', 'polarity': 'positive'}, {'term': 'rock shrimp tempura', 'polarity': 'positive'}]"
37,"I tend to judge a sushi restaurant by its sea urchin, which was heavenly at sushi rose.","[{'term': 'sea urchin', 'polarity': 'positive'}]"
44,"$6 and there is much tasty food, all of it fresh and continually refilled.","[{'term': 'food', 'polarity': 'positive'}, {'term': 'food', 'polarity': 'positive'}, {'term': 'food', 'polarity': 'positive'}]"
47,"I like the somosas, chai, and the chole, but the dhosas and dhal were kinda dissapointing.","[{'term': 'somosas', 'polarity': 'positive'}, {'term': 'chai', 'polarity': 'positive'}, {'term': 'chole', 'polarity': 'positive'}, {'term': 'dhosas', 'polarity': 'negative'}, {'term': 'dhal', 'polarity': 'negative'}]"
109,"Try the crunchy tuna, it is to die for.","[{'term': 'crunchy tuna', 'polarity': 'positive'}]"
121,I'm not sure where the other reviewers ate but it seems as if we visited two different restaurants because my friends and I all enjoy Mizu very much... and we're repeat customers.,"[{'term': 'Mizu', 'polarity': 'positive'}]"
138,I loved everythig about it-especially the shows and actors.,"[{'term': 'shows', 'polarity': 'positive'}, {'term': 'actors', 'polarity': 'positive'}]"
143,Service was prompt and courteous.,"[{'term': 'Service', 'polarity': 'positive'}]"
159,"Service was very good - prompt, attentive and non-intrusive.","[{'term': 'Service', 'polarity': 'positive'}]"
215,The atmosphere is noisy and the waiters are literally walking around doing things as fast as they can.,"[{'term': 'atmosphere', 'polarity': 'negative'}, {'term': 'waiters', 'polarity': 'positive'}]"
220,We both opted for a pasta dish and they were served timely and fresh.,"[{'term': 'pasta dish', 'polarity': 'positive'}]"
223,"The staff was accomodating, the food was absolutely delicious and the place is lovely.","[{'term': 'staff', 'polarity': 'positive'}, {'term': 'food', 'polarity': 'positive'}, {'term': 'place', 'polarity': 'positive'}]"
271,I've never had bad service and the fish is fresh and delicious.,"[{'term': 'service', 'polarity': 'positive'}, {'term': 'fish', 'polarity': 'positive'}]"
273,"I come from a family of pizzeria owners, and I'm almost ashamed to say that the pizza in Fornino's blows my families receipies away.","[{'term': 'pizza', 'polarity': 'positive'}]"
278,The dining room is quietly elegant with no music to shout over -- how refreshing!,"[{'term': 'dining room', 'polarity': 'positive'}]"
284,My boyfriend had the New England Chowder it was good but I think the award should go to the Lobster Bisque.,"[{'term': 'New England Chowder', 'polarity': 'positive'}, {'term': 'Lobster Bisque', 'polarity': 'positive'}]"
289,Go to Volare for 1st class service and terrific food.,"[{'term': 'service', 'polarity': 'positive'}, {'term': 'food', 'polarity': 'positive'}]"
304,The staff was the friendliest that have seen in New York.,"[{'term': 'staff', 'polarity': 'positive'}]"
305,If you want something really different than try Jekyll and Hyde.,"[{'term': 'Jekyll and Hyde', 'polarity': 'positive'}]"
314,Great pizza for lunch place.,"[{'term': 'pizza', 'polarity': 'positive'}]"
323,They have a huge selection of different cream cheeses and all of their salads are great.,"[{'term': 'salads', 'polarity': 'positive'}, {'term': 'cream cheeses', 'polarity': 'positive'}]"
332,Thius is a must for anyone who loves Shabu-Shabu.,"[{'term': 'Shabu-Shabu', 'polarity': 'positive'}]"
343,This quaint and romantic trattoria is at the top of my Manhattan restaurant list.,"[{'term': 'trattoria', 'polarity': 'positive'}, {'term': 'trattoria', 'polarity': 'positive'}]"
350,Thank You Emilio.,"[{'term': 'Emilio', 'polarity': 'positive'}]"
351,"I found the food, service and value exceptional everytime I have been there.","[{'term': 'food', 'polarity': 'positive'}, {'term': 'service', 'polarity': 'positive'}]"
361,The hostess and the waitress were incredibly rude and did everything they could to rush us out.,"[{'term': 'hostess', 'polarity': 'negative'}, {'term': 'waitress', 'polarity': 'negative'}]"
403,This is a nice restaurant if you are looking for a good place to host an intimate dinner meeting with business associates.,"[{'term': 'restaurant', 'polarity': 'positive'}]"
413,The service is good and ambience is good for a date or group outing.,"[{'term': 'service', 'polarity': 'positive'}, {'term': 'ambience', 'polarity': 'positive'}]"
422,We thought that this place is using too much of MSG cooking in the foods.,"[{'term': 'foods', 'polarity': 'negative'}]"
425,Have frequented 'ino for several years and the food remains excellent.,"[{'term': 'food', 'polarity': 'positive'}]"
428,"(The asparagus, truffle oil, parmesan bruschetta is a winner!)","[{'term': 'asparagus, truffle oil, parmesan bruschetta', 'polarity': 'positive'}]"
429,Wine list is extensive without being over-priced.,"[{'term': 'Wine list', 'polarity': 'positive'}, {'term': 'Wine list', 'polarity': 'positive'}]"
436,"The service was terrible, we had to wait for everything and ask several of different people for the same thing before we were allowed to be served.","[{'term': 'service', 'polarity': 'negative'}]"
438,"After dinner the manager grabbed my boyfriend, asked him: Where are you from...maybe you dont know how things work in America...and in the end stormed away almost teareyed yelling that tips are the only thing they survive on.","[{'term': 'manager', 'polarity': 'negative'}]"
439,"We did tip, I guess the model/waitress just wanted more and complained to the manager.","[{'term': 'waitress', 'polarity': 'negative'}]"
473,The place was nice and calm.,"[{'term': 'place', 'polarity': 'positive'}]"
485,And the Tom Kha soup was pathetic.,"[{'term': 'Tom Kha soup', 'polarity': 'negative'}]"
498,"The dishes offered were unique, very tasty and fresh from the lamb sausages, sardines with biscuits, large whole shrimp to the amazing pistachio ice cream (the best and freshest I've ever had).","[{'term': 'dishes', 'polarity': 'positive'}, {'term': 'lamb sausages', 'polarity': 'positive'}, {'term': 'sardines with biscuits', 'polarity': 'positive'}, {'term': 'large whole shrimp', 'polarity': 'positive'}, {'term': 'pistachio ice cream', 'polarity': 'positive'}]"
518,"Always a nice crowd, but never loud.","[{'term': 'crowd', 'polarity': 'positive'}]"
527,I highly recommend the Sophia pizza.,"[{'term': 'Sophia pizza', 'polarity': 'positive'}]"
579,"Bagels are ok, but be sure not to make any special requests!","[{'term': 'Bagels', 'polarity': 'neutral'}]"
580,I asked for an open faced cheese sandwich and the manager basically told me to take my business elsewhere!,"[{'term': 'manager', 'polarity': 'negative'}]"
583,The worst excuse for Japanese food I've ever encountered.,"[{'term': 'Japanese food', 'polarity': 'negative'}]"
593,"Well, this place is so Ghetto its not even funny.","[{'term': 'place', 'polarity': 'negative'}]"
608,"As a retired hipster, I can say with some degree of certainty that for the last year Lucky Strike has been the best laid-back late night in the city.","[{'term': 'Lucky Strike', 'polarity': 'positive'}]"
645,Spreads and toppings are great - though a bit pricey.,"[{'term': 'Spreads', 'polarity': 'positive'}, {'term': 'toppings', 'polarity': 'positive'}, {'term': 'Spreads', 'polarity': 'negative'}, {'term': 'toppings', 'polarity': 'negative'}]"
660,The food was absolutely amazing!!,"[{'term': 'food', 'polarity': 'positive'}]"
709,Warm and friendly in the winter and terrific outdoor seating in the warmer months.,"[{'term': 'outdoor seating', 'polarity': 'positive'}]"
742,go here for the drinks!,"[{'term': 'drinks', 'polarity': 'positive'}]"
768,The food was delicious but do not come here on a empty stomach.,"[{'term': 'food', 'polarity': 'positive'}, {'term': 'food', 'polarity': 'negative'}]"
787,Atmosphere is nice and relaxed too...,"[{'term': 'Atmosphere', 'polarity': 'positive'}]"
802,He offers subpar service and has no personality.,"[{'term': 'service', 'polarity': 'negative'}]"
847,"We had half/half pizza, mine was eggplant and my friend had the buffalo and it was sooo huge for a small size pizza!","[{'term': 'half/half pizza', 'polarity': 'positive'}]"
851,Great sake!,"[{'term': 'sake', 'polarity': 'positive'}]"
875,I think the pizza is so overrated and was under cooked.,"[{'term': 'pizza', 'polarity': 'negative'}]"
877,I love this place,"[{'term': 'place', 'polarity': 'positive'}]"
898,Favorite Sushi in NYC,"[{'term': 'Sushi', 'polarity': 'positive'}]"
906,My quesadilla tasted like it had been made by a three-year old with no sense of proportion or flavor.,"[{'term': 'quesadilla', 'polarity': 'negative'}, {'term': 'quesadilla', 'polarity': 'negative'}]"
911,"The food was good, the place was clean and affordable.","[{'term': 'food', 'polarity': 'positive'}, {'term': 'place', 'polarity': 'positive'}, {'term': 'place', 'polarity': 'positive'}]"
932,"Overall, decent food at a good price, with friendly people.","[{'term': 'food', 'polarity': 'neutral'}, {'term': 'food', 'polarity': 'positive'}, {'term': 'people', 'polarity': 'positive'}]"
933,Best Indian Restaurant in the City,"[{'term': 'Indian Restaurant', 'polarity': 'positive'}]"
938,Best restaurant in Brooklyn,"[{'term': 'restaurant', 'polarity': 'positive'}]"
943,The food is all shared so we get to order together and eat together.,"[{'term': 'food', 'polarity': 'positive'}]"
949,Thank you everyone at Water's Edge.,"[{'term': ""Water's Edge"", 'polarity': 'positive'}]"
965,The boths are not as small as some of the reviews make them out to look they're perfect for 2 people.,"[{'term': 'boths', 'polarity': 'positive'}]"
998,Sushi experience was unbelievable with my fiance.,"[{'term': 'Sushi', 'polarity': 'positive'}]"
1022,"great food, great wine list, great service in a great neighborhood...","[{'term': 'food', 'polarity': 'positive'}, {'term': 'wine list', 'polarity': 'positive'}, {'term': 'service', 'polarity': 'positive'}, {'term': 'neighborhood', 'polarity': 'positive'}]"
1032,This place has great indian chinese food.,"[{'term': 'indian chinese food', 'polarity': 'positive'}]"
1033,"Be prepared to wait, because the place is pretty tiny.","[{'term': 'place', 'polarity': 'negative'}]"
1054,The environment is very upscale and you will see a lot of rich guys with trophy wives or just highly paid escorts.,"[{'term': 'environment', 'polarity': 'neutral'}]"
1059,I literally just got back home after visiting Casa La Femme and was so offended by my visit felt it necessary to try and warn other diners who value their money and time.,"[{'term': 'Casa La Femme', 'polarity': 'negative'}, {'term': 'Casa La Femme', 'polarity': 'negative'}]"
1060,We did arrive late for our reservation so I can not complain too much about the wait for a table.,"[{'term': 'wait', 'polarity': 'neutral'}]"
1068,I would not expect this for a $55 dinner.,"[{'term': 'dinner', 'polarity': 'negative'}, {'term': 'dinner', 'polarity': 'negative'}]"
1076,"The lobster knuckles (special of the day) were ok, but pretty tasteless.","[{'term': 'lobster knuckles', 'polarity': 'neutral'}, {'term': 'lobster knuckles', 'polarity': 'negative'}]"
1080,I heard the lobster roll was excellent. ,"[{'term': 'lobster roll', 'polarity': 'positive'}]"
1083,Great Indian food,"[{'term': 'Indian food', 'polarity': 'positive'}]"
1097,"It wasn't as if this restaurant had any major bragging points before hand, but now it's simply repulsive.","[{'term': 'restaurant', 'polarity': 'negative'}]"
1100,The service was spectacular as the waiter knew everything about the menu and his recommendations were amazing!,"[{'term': 'service', 'polarity': 'positive'}, {'term': 'waiter', 'polarity': 'positive'}]"
1104,The nakgi-bokum was horrible.,"[{'term': 'nakgi-bokum', 'polarity': 'negative'}]"
1157,"A different server enhanced the fun, dumping our entrees in front of us halfway through our appetizer (which was delicious).","[{'term': 'server', 'polarity': 'negative'}, {'term': 'appetizer', 'polarity': 'positive'}]"
1201,"My father had the flank steak which was very good, and my mother had the swordfish.","[{'term': 'flank steak', 'polarity': 'positive'}]"
1207,Great Atmosphere,"[{'term': 'Atmosphere', 'polarity': 'positive'}]"
1223,"I was shocked that my friends wanted to stay after the waitress said, ""can I help you"" and ""how many are in your party.""","[{'term': 'waitress', 'polarity': 'negative'}]"
